source,endpoint,notebooks,source_context,freshness,interpretation_scope
arXiv API,https://export.arxiv.org/api/query,"01,02",live public API,weekly/monthly,preprints are not peer-reviewed; cross-listing can double count
arXiv monthly submissions,https://arxiv.org/show_monthly_submissions,"00,01",official public stats page,monthly,global totals are separate from category-level time series
Hugging Face Hub API,https://huggingface.co/api/models,03,live public API; repeated snapshots support time-series analysis,daily/weekly,downloads and likes are public adoption proxies
GitHub REST API,https://api.github.com/repos/{owner}/{repo}/stargazers,04,live public API; token recommended,weekly,stars are public repository-interest signals
Wikimedia Analytics API,https://wikimedia.org/api/rest_v1/metrics/pageviews/per-article/...,05,live public API,daily/weekly,pageviews reflect public attention during the selected period
DeFiLlama stablecoin API,https://stablecoins.llama.fi/stablecoins?includePrices=true,06,live public API,daily/weekly,stablecoin endpoint schema should be checked during refresh
CoinGecko API,https://api.coingecko.com/api/v3/coins/{id}/market_chart,06,live public API,per run,rate limits and plan limits apply
Yahoo Finance via yfinance,yfinance.download,07,live public market data via yfinance,per run,unofficial public wrapper; use licensed point-in-time vendor for production
